
mysql> use countryinfo;
Database changed
mysql> create table countries(
    -> country_name varchar(20) not null,
    -> country_id int not null,
    -> region_id int not null,
    -> primary key(region_id)
    -> );
Query OK, 0 rows affected (0.03 sec)

mysql> desc countries
    -> desc countries;
ERROR 1064 (42000): You have an error in your SQL syntax; check the manual that corresponds to your MySQL server version for the right syntax to use near 'desc countries' at line 2
mysql> desc countries;
+--------------+-------------+------+-----+---------+-------+
| Field        | Type        | Null | Key | Default | Extra |
+--------------+-------------+------+-----+---------+-------+
| country_name | varchar(20) | NO   |     | NULL    |       |
| country_id   | int         | NO   |     | NULL    |       |
| region_id    | int         | NO   | PRI | NULL    |       |
+--------------+-------------+------+-----+---------+-------+
3 rows in set (0.00 sec)

mysql> insert into countries(country_name,country_id,region_id)values('India',10,21);
Query OK, 1 row affected (0.01 sec)

mysql> insert into countries(country_name,country_id,region_id)values('Russia',20,22);
Query OK, 1 row affected (0.01 sec)

mysql> insert into countries(country_name,country_id,region_id)values('Canada',30,23);
Query OK, 1 row affected (0.01 sec)

mysql> insert into countries(country_name,country_id,region_id)values('China',40,24);
Query OK, 1 row affected (0.01 sec)

mysql> insert into countries(country_name,country_id,region_id)values('US',50,25);
Query OK, 1 row affected (0.01 sec)

mysql> select * from countries;
+--------------+------------+-----------+
| country_name | country_id | region_id |
+--------------+------------+-----------+
| India        |         10 |        21 |
| Russia       |         20 |        22 |
| Canada       |         30 |        23 |
| China        |         40 |        24 |
| US           |         50 |        25 |
+--------------+------------+-----------+
5 rows in set (0.00 sec)

mysql> update countries set country_name='Brazil',country_id=60, where region_id=22;
ERROR 1064 (42000): You have an error in your SQL syntax; check the manual that corresponds to your MySQL server version for the right syntax to use near 'where region_id=22' at line 1
mysql> update countries set country_name='Brazil',country_id=60 where region_id=22;
Query OK, 1 row affected (0.01 sec)
Rows matched: 1  Changed: 1  Warnings: 0

mysql> select * from countries;
+--------------+------------+-----------+
| country_name | country_id | region_id |
+--------------+------------+-----------+
| India        |         10 |        21 |
| Brazil       |         60 |        22 |
| Canada       |         30 |        23 |
| China        |         40 |        24 |
| US           |         50 |        25 |
+--------------+------------+-----------+
5 rows in set (0.00 sec)

mysql> alter table countries add zipcode int not nullafter country_id;
ERROR 1064 (42000): You have an error in your SQL syntax; check the manual that corresponds to your MySQL server version for the right syntax to use near 'nullafter country_id' at line 1
mysql> alter table countries add column zipcode int not null after country_id;
Query OK, 0 rows affected (0.02 sec)
Records: 0  Duplicates: 0  Warnings: 0

mysql> select * from countries;
+--------------+------------+---------+-----------+
| country_name | country_id | zipcode | region_id |
+--------------+------------+---------+-----------+
| India        |         10 |       0 |        21 |
| Brazil       |         60 |       0 |        22 |
| Canada       |         30 |       0 |        23 |
| China        |         40 |       0 |        24 |
| US           |         50 |       0 |        25 |
+--------------+------------+---------+-----------+
5 rows in set (0.00 sec)

mysql> delete from countries where region_id = 24;
Query OK, 1 row affected (0.01 sec)

mysql> select * from countries;
+--------------+------------+---------+-----------+
| country_name | country_id | zipcode | region_id |
+--------------+------------+---------+-----------+
| India        |         10 |       0 |        21 |
| Brazil       |         60 |       0 |        22 |
| Canada       |         30 |       0 |        23 |
| US           |         50 |       0 |        25 |
+--------------+------------+---------+-----------+
4 rows in set (0.00 sec)

mysql> desc countries;
+--------------+-------------+------+-----+---------+-------+
| Field        | Type        | Null | Key | Default | Extra |
+--------------+-------------+------+-----+---------+-------+
| country_name | varchar(20) | NO   |     | NULL    |       |
| country_id   | int         | NO   |     | NULL    |       |
| zipcode      | int         | NO   |     | NULL    |       |
| region_id    | int         | NO   | PRI | NULL    |       |
+--------------+-------------+------+-----+---------+-------+
4 rows in set (0.00 sec)

mysql>